Sheet: Body
A1: Name | B1: CreateTime | C1: Health | D1: MoveSpeed | E1: TurnAngleSpeed | F1: Armor | G1: Power | H1: Special | I1: PNumber | J1: PPercentage | K1: PTime | L1: PDamage | M1: PRange | N1: Parameter1 | O1: Parameter2 | P1: EquipmentI | Q1: EquipmentII | R1: EquipmentIII
A2: BasicBody | B2: 3.5 | C2: 115 | D2: 2 | E2: 1 | F2: 0 | G2: 20 | P2: Weapon
A3: StrongBody | B3: 5 | C3: 150 | D3: 2 | E3: 1 | F3: 3 | G3: 10 | H3: armor+PP | J3: 0.4 | P3: Weapon | Q3: Armor
A4: QuickBody | B4: 4 | C4: 75 | D4: 2.5 | E4: 1.5 | F4: 0 | G4: 25 | H4: damage+PP, speed+P1 | J4: 0.15 | N4: 0.15 | P4: Weapon | R4: Pusher
A5: FightBody | B5: 10 | C5: 165 | G5: 35 | H5: Damage+PP, when enter battlefield, randomly shoot PN enemy | I5: 4 | J5: 0.33
A6: ScoutBody | B6: 9 | C6: 200 | G6: 60 | H6: Equipment Range +PR | M6: 1
A7: WitcherBody | B7: 12 | C7: 215 | G7: 80 | H7: Power recover PP when kill an enermy | J7: 0.3
A8: GeneralBody | B8: 13 | C8: 265 | G8: 50 | H8: Armor+PP,damage+PD when kill an enermy | J8: 0.2 | L8: 2
A9: TestBody | B9: 1 | C9: 100 | D9: 2 | E9: 2 | F9: 0 | G9: 30 | P9: Weapon | Q9: Armor | R9: Pusher

Sheet: Weapon
A1: Name | B1: CreateTime | C1: ShootCoolDown | D1: Damage | E1: DPS | F1: DamageType | G1: ShootSpeed | H1: Range | I1: PowerCost | J1: BulletName | K1: Special | L1: PNumber | M1: PPercentage | N1: PTime | O1: PDamage | P1: PRange | Q1: Parameter1 | R1: Parameter2 | S1: Info
A2: BasicGun | B2: 0.7 | C2: 0.5 | D2: 15 | E2: =RC[-1]/RC[-2] -> 30 | F2: Fire | G2: 0.3 | H2: 4.5 | I2: 0 | J2: BasicBullet
A3: LaserGun | B3: 2 | C3: 0.65 | D3: 11 | E3: =RC[-1]/RC[-2] -> 16.923076923076923 | F3: Light | G3: 0 | H3: 6 | I3: 0 | J3: StraightLight | K3: 对直线上的敌人造成伤害
A4: ShortGun | B4: 1.2 | C4: 0.14000000000000001 | D4: 8 | E4: =RC[-1]/RC[-2] -> 57.142857142857139 | F4: Fire | G4: 0.6 | H4: 3.3 | I4: 0 | J4: BasicBullet | K4: 短射程快射击速度
A5: IceGun | B5: 1.8 | C5: 0.8 | D5: 17 | E5: =RC[-1]/RC[-2] -> 21.25 | F5: Fire | G5: 0.35 | H5: 5 | I5: 0 | J5: IceBullet | K5: 敌人造成P1的减速和PP的减攻速，持续PT秒 | M5: 0.33 | N5: 4 | Q5: 0.5
A6: MagicBallGun | B6: 1.2 | C6: 0.35 | D6: 10 | E6: =RC[-1]/RC[-2] -> 28.571428571428573 | F6: Magic | G6: 0.45 | H6: 4.5 | I6: 5 | J6: MagicBall | K6: 额外发射PN个魔法 | L6: 2
A7: FireBallGun | B7: 5 | C7: 0.66 | D7: 22 | E7: =RC[-1]/RC[-2] -> 33.333333333333329 | F7: Magic | G7: 0.16 | H7: 6 | I7: 7 | J7: FireBall | K7: 对直线上敌人造成伤害，范围PR.额外附加PT秒的每秒PD的灼烧伤害 | N7: 4 | O7: 3
A8: SmartGun | B8: 4.5 | C8: 0.8 | D8: 33 | E8: =RC[-1]/RC[-2] -> 41.25 | F8: Light | G8: 0 | H8: 7.5 | I8: 0 | J8: SmartBullet | K8: 对范围内随机敌人造成伤害，若该敌人的目标不是你，则造成PP的额外伤害 | M8: 1
A9: ReflectLaserGun | B9: 4.5 | C9: 0.7 | D9: 32 | E9: =RC[-1]/RC[-2] -> 45.714285714285715 | F9: Light | G9: 0 | H9: 7 | I9: 0 | J9: ReflectLight | K9: 弹射到附近PN个敌人，每次弹射减少PP的伤害 | L9: 3 | M9: 0.33
A10: BombProjector | B10: 6 | C10: 0.9 | D10: 48 | E10: =RC[-1]/RC[-2] -> 53.333333333333329 | F10: Fire | G10: 0.35 | H10: 9 | I10: 0 | J10: Bomb | K10: 对范围P1的敌人造成P2的伤害 | M10: 0.5 | P10: 2
A11: SKYGun | B11: 12 | C11: 0.12 | D11: 10 | E11: =RC[-1]/RC[-2] -> 83.333333333333343 | F11: Fire | G11: 0.35 | H11: 11 | I11: 0 | J11: SKYBullet | K11: 发射PN个导弹，目标为地方任意单位，每个导弹造成PD伤害 | L11: 1 | O11: 5

Sheet: Pusher
A1: Name | B1: CreateTime | C1: MoveSpeed | D1: TurnAngleSpeed | E1: Special | F1: PNumber | G1: PPercentage | H1: PTime | I1: PDamage | J1: PRange | K1: Parameter1 | L1: Parameter2
A2: BasicPusher | B2: 0.5 | C2: 2.2000000000000002 | D2: 1.2
A3: QuickPusher | B3: 2 | C3: 3.5 | D3: 2.5 | E3: Health-PP | G3: 0.15
A4: JumpPusher | B4: 1.5 | C4: 3 | D4: 2 | E4: 进入战场时获得PP的速度加成，加成缓慢减少，在PT秒后降为0 | G4: 0.5 | H4: 3

Sheet: Armor
A1: Name | B1: CreateTime | C1: Armor | D1: Special | E1: PNumber | F1: PPercentage | G1: PTime | H1: PDamage | I1: PRange | J1: Parameter1 | K1: Parameter2
A2: BasicArmor | B2: 0 | C2: 3
A3: LightArmor | B3: 1 | C3: 1 | D3: Speed+PP | F3: 0.15
A4: HeavyArmor | B4: 2 | C4: 4 | D4: Fire的伤害减少PP | F4: 0.2
A5: RedArmor | B5: 6 | C5: 3 | D5: 伤害减少PD | H5: 5

Sheet: ArmorDamage
A1: Armor | B1: Damage
A2: 1 | B2: =1- 1 / ( 1 +0.04*RC[-1]) -> 3.8461538461538547E-2
A3: 2 | B3: =1- 1 / ( 1 +0.04*RC[-1]) -> 7.4074074074074181E-2
A4: 3 | B4: =1- 1 / ( 1 +0.04*RC[-1]) -> 0.10714285714285721
A5: 4 | B5: =1- 1 / ( 1 +0.04*RC[-1]) -> 0.13793103448275856
A6: 5 | B6: =1- 1 / ( 1 +0.04*RC[-1]) -> 0.16666666666666663
A7: 6 | B7: =1- 1 / ( 1 +0.04*RC[-1]) -> 0.19354838709677413
A8: 7 | B8: =1- 1 / ( 1 +0.04*RC[-1]) -> 0.21875
A9: 8 | B9: =1- 1 / ( 1 +0.04*RC[-1]) -> 0.24242424242424243
A10: 9 | B10: =1- 1 / ( 1 +0.04*RC[-1]) -> 0.26470588235294112
A11: 10 | B11: =1- 1 / ( 1 +0.04*RC[-1]) -> 0.2857142857142857
A12: 11 | B12: =1- 1 / ( 1 +0.04*RC[-1]) -> 0.30555555555555558
A13: 12 | B13: =1- 1 / ( 1 +0.04*RC[-1]) -> 0.32432432432432434
A14: 13 | B14: =1- 1 / ( 1 +0.04*RC[-1]) -> 0.34210526315789469
A15: 14 | B15: =1- 1 / ( 1 +0.04*RC[-1]) -> 0.35897435897435903
A16: 15 | B16: =1- 1 / ( 1 +0.04*RC[-1]) -> 0.375
A17: 16 | B17: =1- 1 / ( 1 +0.04*RC[-1]) -> 0.3902439024390244
A18: 17 | B18: =1- 1 / ( 1 +0.04*RC[-1]) -> 0.40476190476190477
A19: 18 | B19: =1- 1 / ( 1 +0.04*RC[-1]) -> 0.41860465116279066
A20: 19 | B20: =1- 1 / ( 1 +0.04*RC[-1]) -> 0.43181818181818177
A21: 20 | B21: =1- 1 / ( 1 +0.04*RC[-1]) -> 0.44444444444444442
A22: 21 | B22: =1- 1 / ( 1 +0.04*RC[-1]) -> 0.4565217391304347
A23: 22 | B23: =1- 1 / ( 1 +0.04*RC[-1]) -> 0.46808510638297873
A24: 23 | B24: =1- 1 / ( 1 +0.04*RC[-1]) -> 0.47916666666666663
A25: 24 | B25: =1- 1 / ( 1 +0.04*RC[-1]) -> 0.48979591836734693
A26: 25 | B26: =1- 1 / ( 1 +0.04*RC[-1]) -> 0.5